{
  "schema_version": "1.0",
  "room_input": {
    "room_id": "demo-room-compact",
    "image": {
      "reference": "./assets/desk-before.png",
      "media_type": "image/png"
    },
    "reference_width_cm": 100,
    "quality_hint": "clear"
  },
  "inspiration_input": {
    "inspiration_id": "demo-inspiration-compact",
    "source_type": "demo",
    "style_key": "compact"
  },
  "constraints": {
    "budget_cny": 400,
    "hard_constraints": [
      "no_drilling",
      "keep_desk"
    ],
    "soft_preferences": [
      "high_efficiency"
    ],
    "goals": [
      "organization",
      "cable_management"
    ]
  }
}
